{
  "id": "apex-asset-intelligence",
  "name": "APEX Asset Intelligence",
  "owner": "chris",
  "lifecycle": "production",
  "kind": "external-app",
  "entry": "https://apex-app2.onrender.com",
  "versions": [
    {
      "version": "4.0.0",
      "released_at": "2026-06-01",
      "commit": "0000000"
    }
  ],
  "aliases": {
    "current": "4.0.0"
  }
}
