{
  "id": "insight-radar",
  "name": "Insight Radar",
  "description": "Claude Code skill that researches, ranks and publishes the monthly Oil & Gas Technology Radar article.",
  "owner": "chris",
  "lifecycle": "production",
  "kind": "skill",
  "entry": ".claude/skills/insight-radar/SKILL.md",
  "changelog": "tools/insight-radar/CHANGELOG.md",
  "produces": [
    "insight_article",
    "citation_ledger"
  ],
  "versions": [
    {
      "version": "1.3.0",
      "released_at": "2026-07-30",
      "commit": "22b308c",
      "status": "approved"
    },
    {
      "version": "1.2.0",
      "released_at": "2026-07-30",
      "commit": "b392092",
      "status": "approved"
    },
    {
      "version": "1.1.0",
      "released_at": "2026-07-30",
      "commit": "c86a6e3",
      "status": "approved"
    },
    {
      "version": "1.0.0",
      "released_at": "2026-07-30",
      "commit": "ef836f3",
      "status": "approved"
    }
  ],
  "aliases": {
    "current": "1.3.0",
    "previous": "1.2.0"
  }
}
